"","X.2","X.1","X","id","resourceType","title","description","startDate","endDate","lat","lon","documentType","author","Evacuated","Homeless","Injuries","Deaths","Insured.Cost","Train.s..damaged","Train.s..destroyed","Home.s..damaged","Home.s..destroyed","Building.s..damaged","Building.s..destroyed","Ind.Premises.destroyed","Com.Premises.damaged","Com.Premises.destroyed","Bridge.s..damaged","Bridge.s..destroyed","Aircraft.damaged","Aircraft.destroyed","Motor.Vehicle.s..damaged","Motor.Vehicle.s..destroyed","Water.vessel.s..damaged","Water.vessel.s..destroyed","Business.es..damaged","Business.es..destroyed","Farm.s..damaged","Farm.s..destroyed","Crop.s..destroyed","Livestock.destroyed","Government.assistance","regions","subjects","url","resourceUrl","Disasterlength","buildingdestroyedordamaged","Vehiclesdamagedordestroyed"
"141",141,141,369,374,"Disaster Event","Bushfire","The Alpine bushfires started on 8 January 2003, a day of Total Fire Ban. Lightning ignited 87 fires in the North-East and East Gippsland regions. Eight of these fires were unable to be contained; they joined together to form the largest fire in Victoria since the Black Friday fires in 1939. More than 40 fires were also started in New South Wales and Australia Capital Territory.  The majority of the area burnt in Victoria was public land, 1.19 million hectares of parks and forests, including 60 per cent of the Alpine National Park and 81 per cent of the Mt Buffalo National Park. Fire fighting efforts were made difficult in hard to access, remote forest terrain. Approximately 90,000 hectares of private land was burnt. The fires burnt nearly 800,000 hectares in New South Wales and Australia Capital Territory, bringing the total of land affected throughout the Australian Alps to approximately 2 million hectares. The immediate effects of the fires included reduced water quality and quantity, loss of vegetation and habitats, destruction of commercial timber infrastructure, damage to recreation and tourism infrastructure assets and destruction of cultural sites and farms adjacent to public land.  A Ministerial Taskforce, appointed by the Victorian Premier, announced a funding package of $70.6 million for recovery works on public land associated with natural and cultural assets and support for agricultural private landowners affected by the fires. This was the biggest bushfire recovery effort ever undertaken in Victoria at the time. The Bushfire Recovery Program for the environment and agriculture focused on four areas:  1. Asset repair or replacement in parks, forests and alpine resorts ($24.9 million)  2. Protection and restoration of water catchments and water supply ($23.9 million)  3. Restoration of ecological and cultural heritage values ($13.2 million)  4. Providing practical assistance for affected farm enterprises ($8.6 million) Assets lost or damaged included; 41 houses, 213 other structures, three bridges and 10,000 livestock.  The Insurance Council of Australia estimated the 2003 damage for Victoria and New South Wales at $12 million, with the 2011 estimated normalised cost of $24 million.","1/08/2003 0:00","3/19/2003 0:00",-36.72137451,146.7861481,NA,"",0,0,0,0,1.2e+07,0,0,0,41,0,213,0,0,0,0,0,0,0,0,0,0,0,0,0,0,0,0,10000,0,"Victoria",NA,"http://www.emknowledge.gov.au/resource/?id=374",NA,70,254,0
"142",142,142,371,376,"Disaster Event","Storm/Flood","On 24 August 2003, a windstorm developed from an intense low pressure system over Tasmania and was felt along the eastern states from Victoria to New South Wales.  Tasmania  Tasmanian police removed trees blown on to roads by the strong winds on the Murchison Highway in Roseberry on the west coast, and a tree was moved off the Tasman Highway in Buckland on the east coast . Falling trees across power lines cut electricity to the Tasman Peninsula between Sorell and Nubeena.  Rain caused flooding over an extensive area of southern Tasmania and damaged the Buckland Bridge in Orford, which connects the east coast to the Midlands, to the point where it had to be closed for two days.  Police received approximately 400 calls for assistance, the majority from people in the Tasman Peninsula, Bruny Island, the Huon Valley and the east coast.  New South Wales  Sydney and Illawarra districts experienced gale force winds causing considerable damage to trees, boats, aircraft, buildings and power loss to 150,000 homes. Wind gusts reached 141 km per hour at Bellambi Point, 120 km per hour at Albion Park, Manly and Kurnell, 113 km per hour at Sydney Airport and 109 km per hour at Fort Denison. A man died when a tree fell on his car in St Ives. Three people were injured by falling trees in Mosman and Bathurst and another after falling from a roof in Wollongong. Two swimmers were apparently lost when they were blown out to sea off Curl Curl.  Australian Capital Territory  In Canberra strong winds tore roof tiles off houses, uprooted trees and brought down power lines. Canberra Airport reported a maximum wind gust of 93 km per hour.  Victoria  Heavy rain and strong winds caused trees to fall damaging several houses and cutting off major roads across Melbourne and in the north-east of the state, with the State Emergency Service responding to more than 1,500 calls for help.  Maximum wind gusts recorded on 24 August included 90 km per hour at Gelantipy, 91 km per hour at Cape Nelson, 93 km per hour at Mt Buller, 94 km per hour at Aireys Inlet, Cape Otway, Cerberus, Combienbar, Fawkner Beacon and Lookout Hill, 98 km per hour at Dunns Hill, Frankston and Mt Gellibrand. Wind damage occurred around Melbourne and in southern Victoria.  The Insurance Council of Australia estimated the 2003 damage at $25 million, with the 2011 estimated normalised cost of $39 million.","8/24/2003 0:00","8/24/2003 0:00",-37.8119545,144.9635773,NA,"",0,0,4,1,2.5e+07,0,0,0,0,0,0,0,0,0,0,0,0,0,0,0,0,0,0,0,0,0,0,0,0,"Australian Capital Territory;New South Wales;Victoria;Tasmania",NA,"http://www.emknowledge.gov.au/resource/?id=376",NA,0,0,0
"143",143,143,373,378,"Disaster Event","Bushfire","On 10 January 2005 a fire started near the town of Wangary in the Lower Eyre Peninsula and broke its containment lines the following day. As the next day progressed, South Australia faced two significant fires, Mount Osmond in the Adelaide Hills and the Lower Eyre Peninsula (outside Port Lincoln).  A major incident was declared in the afternoon; heat from the fire was 1000 &deg;C with speeds up to 100 km per hour. The fire became known as Black Tuesday and it was not contained until the next day and finally extinguished 20 January 2005. This was the worst fire in South Australia since the 1983 Ash Wednesday fires.  Nine people died in these fires and more than 110 people were injured. Approximately 82,000 ha were burnt. The worst affected areas were Wangary, North Shields, Wanilla, Pooindie, Louth Bay, White Flat, Koppio, Greenpatch and Warunda. Essential services were destroyed; there was loss of electricity, telecommunications, and water supply.  In terms of personal property, 79 houses were destroyed, 26 homes extensively damaged, 139 vehicles destroyed, 324 sheds destroyed or damaged and 6300 km of fencing damaged. Livestock death totalled 46,500 which were mainly sheep. One aircraft was destroyed worth in the vicinity of $100,000.  The recovery process was immediately put into effect. This included a Bushfire Recovery Centre being set up at Port Lincoln High School and a&nbsp;State Recovery Committee meeting for the first time on the 12 January. Personal Hardship and Distress grants were provided and a hot line for Centrelink was established.  The Insurance Council of Australia estimated the 2005 damage at $27.7 million, with the 2011 estimated normalised cost of $41 million.","1/10/2005 0:00","1/12/2005 0:00",-34.71579361,135.8571014,NA,"",0,0,110,9,27700000,0,0,26,79,324,0,0,0,0,0,0,0,1,0,139,0,0,0,0,0,0,0,46500,0,"South Australia",NA,"http://www.emknowledge.gov.au/resource/?id=378",NA,2,429,140
"144",144,144,374,379,"Disaster Event","Storm/Flood","At the beginning of February 2005 a low pressure system brought severe storms to eastern Australia. The weather system resulted in record rainfalls to south-east Australia and abnormally low temperatures through much of the eastern half of the country.  New South Wales  On 2 February, many areas of New South Wales and suburban Sydney experienced hail and heavy rain. Some examples are:    Kellyville, hail 5 cm,  Blacktown, hail 4 cm,  Kings Langley, hail 3 cm,  Quakers Hill, hail 3 cm,  Greystanes, heavy rain and hail 4 cm,  Potts Hill, hail 2-3 cm,  Castle Hill, hail 4-5 cm,  Greenacre, hail 4-5 cm,  St Ives, heavy rain and hail 2 cm,  Wahroona, heavy rain and hail 3 cm,  Gosford, hail 4 cm and Terrigal hail 4-5 cm.    Flash flooding was seen in Bexley (metropolitan Sydney) and in North Ryde. A thunderstorm and possible tornado caused severe local wind damage, bringing down trees and power lines, resulting in power outages to thousands of homes.  The strongest wind gusts during the storm were felt at Bathurst with 93 km per hour, Scone 93 km per hour, Kurnell 94 km per hour and Newcastle 91 km per hour.  The unseasonal cold weather brought snow to some areas of New South Wales where approximately 10-15 cm snow fell in the Snowy Mountains and temperatures reached as low as minus 5&deg;C. On the Brindabella Ranges near Canberra and on the Southern Tablelands, several centimetres of snow settled on the ground. Record low maximum and minimum temperatures occurred over this period, especially in the southern areas of the state.  Victoria  Substantial rainfall was reported in many areas of Victoria with 24 hour rainfall totals exceeding 150 mm in many places. Rainfall in the Melbourne metropolitan area exceeded 100 mm with an all time 24 hour record for Melbourne set at 120.2 mm (the previous record was 108 mm).  The highest wind gusts were recorded at Wilson's Promontory with gusts of up to 148 km per hour. In the Melbourne area wind gusts to 104 km per hour were recorded at Fawkner and Beacon.  Extensive damage to buildings was reported and over 7000 requests for assistance were received by the SES and other emergency services over the following days.  Tasmania  During this storm, Tasmania experienced widespread damage particularly from wind gusts. The strong south easterly winds caused damage from Devonport to Bridport, Scottsdale and Winnaleah in the north-east, Binalong Bay on the East Coast, and to Flinders Island in Bass Strait. Port Sorell (near Devonport) reported many homes to be badly damaged in part due to falling trees.  Approximately 25 yachts in the Tamar River broke their moorings, with 14 reportedly destroyed, causing hundreds of thousands of dollars damage.  The Bass Strait ferry Spirit of Tasmania l was forced to return to Melbourne after sustaining damage in seas estimated at 20 m. The Spirit of Tasmania II was delayed on its voyage from Devonport to Melbourne, while the Spirit of Tasmania III broke its moorings in Devonport and was also slightly damaged.  Fruit crops sustained up to 50 per cent loss; particularly apple and pear growers. Damage was also sustained to poppy and grain crops.  Strong winds battered Tasmania during this storm, some examples are; Mount Wellington 104 km per hour, Mount Read 93 km per hour, Eddystone Point 117 km per hour, Flinders Island Airport 100 km per hour, Launceston Airport 94 km per hour and Cape Bruny on Bruny Island 91 km per hour.  On 3 February substantial rainfall accompanied the storm and flooding occurred in several areas on the east coast, some suburbs of Hobart and in the south-east. The Browns River at Kingston broke its banks causing local flooding with several minor landslides also reported in the area.  South Australia  Gale force winds of up to 67 km per hour occurred at several locations in South Australia during this storm event. These occurred in Marree and briefly at Hindmarsh Island.  The Insurance Council of Australia estimated the 2005 damage for the combined states at $216.7 million, with the estimated 2011 normalised cost of $304 million.","2/01/2005 0:00","2/03/2005 0:00",-33.71191788,150.9577332,NA,"",0,0,0,0,216700000,0,0,0,0,0,0,0,0,0,0,0,0,0,0,0,13,14,0,0,0,0,0,0,0,"Australian Capital Territory;New South Wales;Victoria;South Australia",NA,"http://www.emknowledge.gov.au/resource/?id=379",NA,2,0,27
"145",145,145,379,384,"Disaster Event","Storm/Flood","A severe storm crossed the western suburbs of Sydney late in the afternoon of 16 February 2002 causing considerable damage. It moved in a north north-easterly direction at a speed of about 30 km per hour with very heavy rain and strong wind gusts. The strongest wind gust reported was 96 km per hour at Bankstown Airport. The SES received approximately 8000 requests for assistance. The Insurance Council of Australia estimated the 2002 damage at $10 million, with the 2011 estimated normalised cost of $19 million.","2/16/2002 0:00","2/16/2002 0:00",-33.71273804,151.2968445,NA,"",0,0,0,0,1e+07,0,0,0,0,0,0,0,0,0,0,0,0,0,0,0,0,0,0,0,0,0,0,0,0,"New South Wales",NA,"http://www.emknowledge.gov.au/resource/?id=384",NA,0,0,0
"146",146,146,381,386,"Disaster Event","Cyclone/Tornado","Tropical Cyclone Tracy struck Darwin in the early hours of 25 December 1974, and was rated a Category 4 Tropical Cyclone. Before the failure of instruments, the wind gauges registered speeds of 217 km per hour.  The cyclone caused massive building and infrastructure damage to all power, water, sanitation and communications as well as huge commercial and industrial losses. Over 80 per cent of all buildings were destroyed or seriously damaged.  The cyclone resulted in the death of 71 people, which included 22 who were lost at sea.  Tropical Cyclone Tracy caused the largest ever evacuation and reconstruction operations in peacetime Australia. A total of 35,362 people (of the approx 47,000 population) were evacuated; 25,628 by air (15,950 in civilian aircraft and 9,678 in military aircraft) and the remaining 9,734 by road, to southern cities for many months.  By 1978, it was estimated that Darwin had regained the population level it had in December 1974.  The Insurance Council of Australia estimated the 1974 damage at $200 million, with the 2012 estimated normalised cost of $4090 million.","12/25/1974 0:00","12/25/1974 0:00",-12.46484184,130.837616,NA,"",35362,41000,650,71,2e+08,0,0,200,5000,0,0,0,0,0,0,0,0,0,0,0,20,25,0,0,0,0,0,0,0,"Northern Territory",NA,"http://www.emknowledge.gov.au/resource/?id=386",NA,0,5200,45
"147",147,147,386,391,"Disaster Event","Storm/Flood","In March 2004, tropical cyclones Grace, Monty, Nicky, Fay, Oscar and Evan affected several regions of Australia. Wide spread flooding occurred in Queensland, Western Australia and the Northern Territory. Severe thunderstorms with high rainfall totals, flash flooding and hail were reported in most states over the course of the month. Damage to property, infrastructure and power supplies occurred.  A tropical low developed on 2 March and moved south-west bringing strong to gale force winds, large seas and heavy rain to south-east Queensland and northern New South Wales. Rainfall totals in several east coast locations was more than 200 mm in 24 hours. There were three fatalities associated with this event: one person drowned in Queensland and two people drowned in New South Wales.  In Western Australia, Cyclone Monty weakened as it neared the northern coast but brought with it widespread rainfall over the Pilbara causing significant flooding.  In the Northern Territory, heavy rainfall associated with ex-tropical cyclone Evan affected the Arnhem, Darwin-Daly, Katherine and northern Victoria river districts, resulting in flooding in many catchments throughout the Top End. Residents were evacuated from flooded homes and businesses on the outskirts of Katherine on 4 March.","3/03/2004 0:00","3/31/2004 0:00",-28.80579758,153.2768707,NA,"",0,0,0,3,0,0,0,0,0,0,0,0,0,0,0,0,0,0,0,0,0,0,0,0,0,0,0,0,0,"Northern Territory;Queensland;New South Wales;Western Australia",NA,"http://www.emknowledge.gov.au/resource/?id=391",NA,28,0,0
"148",148,148,393,398,"Disaster Event","Storm/Flood","On 16 May 2005, a strong cold front caused widespread damage to Perth suburbs and parts of the south-west of the state. Several tornadoes occurred on the edge of the front causing serious damage to buildings and houses in the Bicton and Bunbury areas.  The Fire and Emergency Services Authority (FESA) described it as the worst storm in ten years. The SES received over 800 calls for assistance. Five schools were damaged and at Bicton Primary School the music room was ripped from its foundation.  In Bunbury the tornado caused substantial damage to buildings and residences. Heavy rain caused extensive flooding and traffic chaos with roads closed, including a main highway. Some parts of the south-west recorded up to 80 mm of rain in 24 hours.  In excess of 100,000 customers were left without power and the city was littered with downed power poles and live wires. Power was cut along the storm's path in areas such as Bicton, Fremantle, Canningvale, Kwinana and Armadale.  The Insurance Council of Australia estimated the 2005 damage at $53.2 million, with the 2011 normalised cost at $108 million.","5/16/2005 0:00","5/16/2005 0:00",-32.0274353,115.7822495,NA,"",0,0,0,0,53200000,0,0,0,0,0,0,0,0,0,0,0,0,0,0,0,0,0,0,0,0,0,0,0,0,"Western Australia",NA,"http://www.emknowledge.gov.au/resource/?id=398",NA,0,0,0
"149",149,149,400,405,"Disaster Event","Bushfire","During the period 30 November until 2 December, fires caused widespread damage in the Blue Mountains vicinity. The worst affected areas were Leura and Wentworth Falls, with other damage recorded at Megalong Valley, Lithgow and Jenolan Caves.  As a result of the fires, 158 buildings were destroyed and four people died. The damage was estimated at approximately &pound;1,000,000.","11/30/1957 0:00","12/04/1957 0:00",-33.71252823,150.3315277,NA,"",0,0,0,4,0,0,0,0,158,0,0,0,0,0,0,0,0,0,0,0,0,0,0,0,0,0,0,0,0,"New South Wales",NA,"http://www.emknowledge.gov.au/resource/?id=405",NA,4,158,0
"150",150,150,404,409,"Disaster Event","Cyclone/Tornado","A Tropical Cyclone crossed north of Cooktown on 19 January 1907.The damage caused by the cyclone included three churches, two schools, four halls, three hotels, several shops and many homes. A total of nine deaths were recorded.","1/19/1907 0:00","1/19/1907 0:00",-15.46823978,145.254364,NA,"",0,0,0,9,0,0,0,0,0,12,0,0,0,0,0,0,0,0,0,0,0,0,0,0,0,0,0,0,0,"Queensland",NA,"http://www.emknowledge.gov.au/resource/?id=409",NA,0,12,0
"151",151,151,406,411,"Disaster Event","Drought/Heatwave","Three people died in Townsville from heat stress as the city experienced record high temperatures of up to 45 degrees celcius.","1/06/1994 0:00","1/10/1994 0:00",-19.25743103,146.8178558,NA,"",0,0,0,3,0,0,0,0,0,0,0,0,0,0,0,0,0,0,0,0,0,0,0,0,0,0,0,0,0,"Queensland",NA,"http://www.emknowledge.gov.au/resource/?id=411",NA,4,0,0
"152",152,152,409,414,"Disaster Event","Storm/Flood","On 27 December, a cyclone passed through the Whitsunday Passage. The cyclone brought about heavy rainfall to Clermont, Sapphire and Peak Downs. Rivers including the Mackenzie, Comet, Nogoa and Barcoo were all subject to flooding. There was widespread damage, destruction to property and loss of stock. The lower part of Clermont was submerged, which resulted in Clermont being rebuilt on higher ground.  As a result of the flood, 61 people drowned.","12/27/1916 0:00","12/27/1916 0:00",-22.81669426,147.6480103,NA,"",0,0,0,61,0,0,0,0,0,0,0,0,0,0,0,0,0,0,0,0,0,0,0,0,0,0,0,0,0,"Queensland",NA,"http://www.emknowledge.gov.au/resource/?id=414",NA,0,0,0
"153",153,153,410,415,"Disaster Event","Storm/Flood","On 21 January 1977 severe thunderstorms spread over New South Wales, affecting mainly the Sydney regions of Bankstown and Richmond. Winds reached 124 km per hour and there was one fatality.  The Insurance Council of Australia estimated the 1977 damage at $15 million, with the 2011 estimated normalised cost of $244 million.","1/21/1977 0:00","1/21/1977 0:00",-33.80190277,150.9441681,NA,"",0,0,0,1,1.5e+07,0,0,0,0,0,0,0,0,0,0,0,0,0,0,0,0,0,0,0,0,0,0,0,0,"New South Wales",NA,"http://www.emknowledge.gov.au/resource/?id=415",NA,0,0,0
"154",154,154,411,416,"Disaster Event","Storm/Flood","The Hunter Valley floods occurred as a result of heavy rainfall; over 250 mm between Nevertire and Dunedoo. Damage was widespread across the Hunter Valley and 24 deaths were recorded.  Over 40,000 people were evacuated from over 40 towns. In the Hunter Valley, around Singleton and Maitland, 15,000 residents were evacuated, 5,200 homes were flooded and 58 homes were destroyed or washed away.  The Castlereagh River reached a record height. At Gilgrandra, one third&nbsp;of the buildings were damaged and a hole&nbsp;torn in the main street was later found to contain two large semi-trailers.  The Namoi and Gwydir Valleys were devastated. Narrabri was completely isolated. Water up to 3 m deep covered some streets and approximately 1000 homes sustained water damage.","2/22/1955 0:00","2/28/1955 0:00",-31.82798195,147.7187347,NA,"",40000,15000,0,24,0,0,0,5200,58,0,0,0,0,0,0,0,0,0,0,0,0,0,0,0,0,0,0,0,0,"New South Wales",NA,"http://www.emknowledge.gov.au/resource/?id=416",NA,6,5258,0
"155",155,155,416,421,"Disaster Event","Cyclone/Tornado","Late on 6 January 1897 a cyclone built up in the city of Port Darwin, striking in the early hours of 7 January. Its peak was recorded at approximately 3.30 - 4.30am. Rainfall in Darwin during the passage of this cyclone was recorded at 292 mm. The cyclone was the largest recorded before Cyclone Tracy; it uplifted rooves, uprooted trees and telephone poles, and blew apart houses, destroying almost all of the buildings in Port Darwin by approximately 7.30 am. Eighteen pearling luggers, the government steam launch and three sampans were wrecked. Twenty-eight people were killed by the cyclone.  The Bureau of Meteorology estimated the costs to exceed &pound;150,000, in 1897 values.","01/06/1897 00:00:00","01/07/1897 00:00:00",-12.45970917,130.8193665,NA,"",0,0,0,28,0,0,0,0,0,0,0,0,0,0,0,0,0,0,0,0,0,22,0,0,0,0,0,0,0,"Northern Territory",NA,"http://www.emknowledge.gov.au/resource/?id=421",NA,1,0,22
"156",156,156,419,424,"Disaster Event","Storm/Flood","On 18 November 2001, severe thunderstorms affected many parts of eastern New South Wales. Most of the impact was felt at Nelson Bay, where thunderstorms and tornadoes occurred with winds reaching up to 150 km per hour. It was reported more than 100 buildings were damaged and several boats destroyed.  Significant damage also occurred in the Lower Hunter Valley and the Sydney metropolitan regions of Penrith, Richmond and Horsley Park from strong wind gusts. Approximately 2000 homes and 200 cars were damaged and three people were killed.  Wisemans Ferry reported hail 3 cm in diameter. More hail similar in size occurred at Bundarra, Ben Lomond (Northern Tablelands), and in Canberra small hail fell in the northern suburbs on the afternoon on 18 November.  The Insurance Council of Australia estimated the 2001 damage at $30 million, with the 2011 estimated normalised cost of $99 million.","11/18/2001 0:00","11/21/2001 0:00",-32.72064972,152.1438293,NA,"",0,0,0,3,3e+07,0,0,2000,0,0,0,0,0,0,0,0,0,0,200,0,0,0,0,0,0,0,0,0,0,"New South Wales",NA,"http://www.emknowledge.gov.au/resource/?id=424",NA,3,2000,200
"157",157,157,422,427,"Disaster Event","Bushfire","In 1984 New South Wales suffered its worst bushfire season in a decade. The season begun in early September 1984 and persisted into the following year finishing around February 1985, spanning just over five months. On Christmas Day 1984 more than 100 fires were started by lightning strikes with approximately 500,000 ha burnt. The biggest fire was in January at Cobar where around 516,000 ha was destroyed by fire. The bushfire season for 1984/1985 produced around 6000 separate incidents with a total of 3.5 million ha damaged.  The bushfires created widespread damage and heavy losses to farming communities, which included losses to crops, plantations, machinery and equipment as well as 40,000 livestock. The bushfires claimed the lives of four people.  The Insurance Council of Australia estimated the 1985 damage at $25 million, with the 2011 estimated normalised cost of $179 million.","9/01/1984 0:00","2/01/1985 0:00",-31.49797058,145.8381958,NA,"",0,0,0,4,2.5e+07,0,0,0,0,0,0,0,0,0,0,0,0,0,0,0,0,0,0,0,0,0,0,40000,0,"New South Wales",NA,"http://www.emknowledge.gov.au/resource/?id=427",NA,153,0,0
"158",158,158,423,428,"Disaster Event","Storm/Flood","Thunderstorms coupled with heavy rain occurred in the Sydney metropolitan area late 9 Apri 1998 and into the following day. Much of the reported damage was due to flash flooding. Hundreds of SES staff and volunteers worked to protect homes around the Narrabeen Lake area as water levels rose to a 15 year high. Three houses were evacuated as they were threatened by stormwater at the rear of their properties. Approximately 5,000 homes lost power after the heavy rains. One person drowned after being swept away in a swollen creek. Avalon and Belrose recorded rainfall levels in excess of 200 mm.  The Bureau of Meteorology advised the event was caused by an upper level system interacting with warm, moist onshore flow lifted by a trough off the coast.  The Insurance Council of Australia estimated the 1998 damage at $10 million, with the 2011 estimated normalised cost of $28 million.","4/09/1998 0:00","4/10/1998 0:00",-33.91579819,151.0357513,NA,"",0,0,0,1,1e+07,0,0,80,0,10,0,0,0,0,0,0,0,0,0,0,0,0,5,0,0,0,0,0,0,"New South Wales",NA,"http://www.emknowledge.gov.au/resource/?id=428",NA,1,95,0
