"","X.2","X.1","X","id","resourceType","title","description","startDate","endDate","lat","lon","documentType","author","Evacuated","Homeless","Injuries","Deaths","Insured.Cost","Train.s..damaged","Train.s..destroyed","Home.s..damaged","Home.s..destroyed","Building.s..damaged","Building.s..destroyed","Ind.Premises.destroyed","Com.Premises.damaged","Com.Premises.destroyed","Bridge.s..damaged","Bridge.s..destroyed","Aircraft.damaged","Aircraft.destroyed","Motor.Vehicle.s..damaged","Motor.Vehicle.s..destroyed","Water.vessel.s..damaged","Water.vessel.s..destroyed","Business.es..damaged","Business.es..destroyed","Farm.s..damaged","Farm.s..destroyed","Crop.s..destroyed","Livestock.destroyed","Government.assistance","regions","subjects","url","resourceUrl","Disasterlength","buildingdestroyedordamaged","Vehiclesdamagedordestroyed"
"68",68,68,184,188,"Disaster Event","Storm/Flood","On 6 December 1986 two severe storms occurred over Adelaide and region with strong winds heavy and rain. Most damage was caused by wind and there was some flooding reported. Some areas in Adelaide Hills and the Far-North of the state were flooded.  The Insurance Council of Australia estimated the 1986 damage at $10 million, with the 2011 estimated normalised cost of $50 million.","12/06/1986 0:00","12/08/1986 0:00",-34.92745972,138.5999908,NA,"",0,50,0,0,1e+07,0,0,0,0,0,0,0,0,0,0,0,0,0,0,0,0,0,0,0,0,0,0,0,0,"South Australia",NA,"http://www.emknowledge.gov.au/resource/?id=188",NA,2,0,0
"69",69,69,187,191,"Disaster Event","Storm/Flood","On 9 November 1976, a severe hailstorm spread across the Sydney metropolitan area, focusing on the western suburbs. Wind gusts reached 96 km per hour and large hailstones ranging between one and 4.4 cm in diameter were recorded. The storm caused extensive damage to homes and vehicles and ten people sustained injuries.  The Insurance Council of Australia estimated the 1976 damage at $40 million, with the 2011 estimated normalised cost of $650 million.","11/09/1976 0:00","11/09/1976 0:00",-33.85551834,150.862793,NA,"",0,0,10,0,7.32e+08,0,0,0,0,0,0,0,0,0,0,0,0,0,0,0,0,0,0,0,0,0,0,0,0,"New South Wales",NA,"http://www.emknowledge.gov.au/resource/?id=191",NA,0,0,0
"70",70,70,189,193,"Disaster Event","Storm/Flood","A tropical cyclone brought about heavy rainfall to the Bowen district. A 1.5 m wall of water flowed at a rate of 14 km per hour through Clermont destroying houses, furniture, fences, business and livestock. Other towns affected included Peak Downs, Lilyvale and Capella.  As a result of the floods 15 people died.","01/02/1870 00:00:00","01/02/1870 00:00:00",-22.81669426,147.6480103,NA,"",0,0,0,15,0,0,0,0,0,0,0,0,0,0,0,0,0,0,0,0,0,0,0,0,0,0,0,0,0,"Queensland",NA,"http://www.emknowledge.gov.au/resource/?id=193",NA,0,0,0
"71",71,71,191,195,"Disaster Event","Bushfire","On 16 October 1991, a number of fires erupted on the coast of New South Wales many of which were believed to be deliberately lit. Major towns affected included Kenthurst, Hunter, Shoalhaven, Baulkham Hills, Gosford, Wyong Shire, Lake Macquarie and Cooma. Approximately 2500 firefighters were activated to control around thirty separate incidents across the state. A total of fourteen homes were completely destroyed and two people died via the fires at Kenthurst.","10/16/1991 0:00","1/31/1992 0:00",-33.65120697,151.0015869,NA,"",0,0,0,2,1.2e+07,0,0,0,14,0,0,0,0,0,0,0,0,0,0,0,0,0,0,0,0,0,0,0,0,"New South Wales",NA,"http://www.emknowledge.gov.au/resource/?id=195",NA,107,14,0
"72",72,72,192,196,"Disaster Event","Bushfire","On 14 January 1985 a significant number of bushfires started in Victoria predominantly from lightning strikes. A major fire in Central Victoria burnt 50,800 hectares of land, including 17,600 hectares of Crown Land. Three people died and over 180 houses, 500 farms and 46,000 livestock were destroyed as a result of the fire. Areas affected including Avoca, Maryborough, and Little River. A large number of fires also started in the Victorian alpine areas, the largest at Mt Buffalo burning 51,400 hectares. Overall, 111 fires started on public land on and it took two weeks to bring the fires under control.","1/14/1985 0:00","1/28/1985 0:00",-37.04653931,143.736969,NA,"",0,600,0,3,0,0,0,0,180,0,0,0,0,0,0,0,0,0,0,0,0,0,0,0,0,500,0,46000,0,"Victoria",NA,"http://www.emknowledge.gov.au/resource/?id=196",NA,14,180,0
"73",73,73,193,197,"Disaster Event","Drought/Heatwave","A severe dry commenced in February 1951. Low rainfall, grass fires and bushfires over an area of about 6 million ha and cold winters caused one of the worst droughts in Queensland. Losses occurred in the cropping, farming and dairy industries. Crop and dairy production were the lowest since 1926. The dry conditions continued until April 1952. A further period of dry weather followed in 1953. By early 1954 the drought covered the Gulf of Carpentaria to the Darling Downs and west to the border with South Australia.","1/01/1951 0:00","4/01/1954 0:00",-25.16517258,143.6572266,NA,"",0,0,0,0,0,0,0,0,0,0,0,0,0,0,0,0,0,0,0,0,0,0,0,0,0,0,0,1e+05,0,"Western Australia",NA,"http://www.emknowledge.gov.au/resource/?id=197",NA,1186,0,0
"74",74,74,197,201,"Disaster Event","Storm/Flood","During the period between 17-18 August, a low pressure trough moved along the central and southern New South Wales coast causing heavy rainfall. On 17 August between the hours 6:00 pm to 9:00 pm, a thunderstorm remained over the Wollongong area dumping heavy falls. Due to the flash flooding, many areas were isolated until 9:00 pm.  As a result, major roads and train lines to Wollongong were disrupted and mudslides were reported on some roads, including Bulli Pass. Fifty homes were flooded in north Wollongong, and it was reported homes along the coast were dislodged from their foundations. One person drowned in attempting to cross a flooded creek at Bellambi.  Damage recorded in Sydney suburbs included; erosion of beach side suburbs, 14 metropolitan roads blocked, power loss to thousands of homes, reports of winds reaching up to 92 km per hour which brought down trees and power lines.  Due to the impact of the flood, the State Emergency Services (SES) obtained access to the Natural Disaster Relief Arrangements (NDRA) funding which assisted in the response efforts. During the cleanup operation up to 450 personnel assisted and 41 SES volunteer units sent teams into Wollongong.  Rainfall recorded for 24 hours to 9:00am on 18 August were:  Mt Ousley: 445 mm  Bulli Pass: 410 mm  Keiraville: 337 mm  Figtree: 313 mm  Wollongong: 316 mm  The Insurance Council of Australia estimated the 1998 damage at $40 million, with the 2011 estimated normalised cost of $97 million.","8/17/1998 0:00","8/19/1998 0:00",-34.42443466,150.8930969,NA,"",0,0,0,1,4e+07,0,0,50,0,0,0,0,0,0,0,0,0,0,0,0,0,0,0,0,0,0,0,0,0,"New South Wales",NA,"http://www.emknowledge.gov.au/resource/?id=201",NA,2,50,0
"75",75,75,202,206,"Disaster Event","Bushfire","Throughout February and March 1926, forest fires raged across large areas of Gippsland. In total, 60 people died. There was&nbsp;widespread destruction to farms, houses and sawmills. It is estimated 400,000 hectares of forest was burnt. The fires reached their peak on 14 February (Black Sunday) when 31 people died at Warburton near Melbourne. Other areas badly affected include Noojee, Kinglake, Erica and the Dandenong Ranges. Widespread fires also occurred across New South Wales, Australian Capital Territory and Queensland.","2/01/1926 0:00","3/10/1926 0:00",-37.75360107,145.6890869,NA,"",0,700,0,60,0,0,0,0,0,0,0,0,0,0,0,0,0,0,0,0,0,0,0,0,0,0,0,0,0,"Victoria",NA,"http://www.emknowledge.gov.au/resource/?id=206",NA,37,0,0
"76",76,76,206,210,"Disaster Event","Bushfire","On 2 December 1998, a fire six km north of Linton and 30 km west of Ballarat in Western Victoria, burnt 660 hectares of public and private land. In the evening two CFA fire trucks became surrounded by fire. The crew managed to save themselves in one of the trucks however the other was destroyed by fire and the crew of five volunteer firefighters died.  A Coronial Inquest was undertaken and after a lengthy review process a report was produced on 11 January 2002 detailing 55 recommendations.","12/02/1998 0:00","12/02/1998 0:00",-37.68438339,143.5633545,NA,"",0,0,0,5,0,0,0,0,0,0,0,0,0,0,0,0,0,0,0,2,0,0,0,0,0,0,0,0,0,"Victoria",NA,"http://www.emknowledge.gov.au/resource/?id=210",NA,0,0,2
"77",77,77,208,212,"Disaster Event","Storm/Flood","On 24 January 1974, torrential rain and record breaking floods were a direct result of Tropical Cyclone Wanda, which crossed north of Brisbane.  Record flooding occurred in the Bulloo, Paroo, middle and lower reaches of the Flinders, Norman, Gilbert, Cooper, Diamantina, Georgina and Eyre rivers and creeks as well as Nerang, Brisbane City metropolitan, upper Brisbane, Bremer, Warrill and Logan rivers. By 29 January the Brisbane area had recorded 900 mm of rain. Brisbane also received 314 mm of rain in a 24 hour period surpassing the previous record established in 1931.  Six thousand houses were inundated by flood waters, where 56 were either completely destroyed or deemed uninhabitable. There was widespread damage to infrastructure including roads, railways and bridges as well as power lines, resulted in serious power failures throughout the affected regions. Business and industries sustained millions of dollars in losses due to the heavy deluge.  The Insurance Council of Australia estimated the 1974 damage at $68 million, with the 2011 estimated normalised cost of $2645 million.","1/25/1974 0:00","1/29/1974 0:00",-27.4712677,153.0091705,NA,"",2500,0,300,13,6.8e+07,0,0,6000,56,0,0,0,0,0,0,0,0,0,0,0,0,0,0,0,0,0,0,0,0,"Queensland",NA,"http://www.emknowledge.gov.au/resource/?id=212",NA,4,6056,0
"78",78,78,213,217,"Disaster Event","Storm/Flood","The Queensland flood of 1893 is often referred to as the Black February Flood. Tropical cyclone Bundinyong brought about extreme weather conditions and heavy rain to the area. Crohamhurst recorded 914 mm in a 24 hour period. Furthermore, the water gauge recorded 8.35 m above the low tide level and 889 mm of rain fell in the Brisbane water catchment reserves.  Further flooding destroyed two major bridges. Both the Victoria bridge and the Indooroopilly Railway bridge collapsed.  There were 35 recorded deaths.","2/01/1893 00:00:00","2/15/1893 00:00:00",-27.61281967,152.7580261,NA,"",0,5000,300,35,0,0,0,0,0,0,0,0,0,0,0,2,0,0,0,0,0,0,0,0,0,0,0,0,0,"Queensland",NA,"http://www.emknowledge.gov.au/resource/?id=217",NA,14,0,0
"79",79,79,214,218,"Disaster Event","Cyclone/Tornado","Cyclone Audrey began on 28 February 1969, and brought rough seas and heavy rain to the north and west coasts of the Northern Territory. It caused only minor damage, including uplifting roofs of buildings at Milingimbi and Maningrida.  At Goulburn Island off the northern Arnhem Land coast four fishermen were killed by the cyclone.","2/28/1969 0:00","3/09/1969 0:00",-12.05006504,134.2199707,NA,"",0,0,0,4,0,0,0,0,0,0,0,0,0,0,0,0,0,0,0,0,0,0,0,0,0,0,0,0,0,"Northern Territory",NA,"http://www.emknowledge.gov.au/resource/?id=218",NA,9,0,0
"80",80,80,218,222,"Disaster Event","Cyclone/Tornado","Tropical Cyclone Emily formed off the southern and central coasts of Queensland resulting in eight deaths (in three separate incidents).  Other damage recorded included flooding at Kingaroy and Brisbane.","3/27/1972 0:00","4/02/1972 0:00",-23.41284752,150.8175659,NA,"",0,0,0,8,0,0,0,0,0,0,0,0,0,0,0,0,0,0,0,0,0,0,0,0,0,0,0,0,0,"Queensland",NA,"http://www.emknowledge.gov.au/resource/?id=222",NA,6,0,0
"81",81,81,220,224,"Disaster Event","Bushfire","During the period between September and November 1994, fires burnt through rural and urban property on the Sunshine Coast, Caboolture, Pine Rivers, Brisbane and other local Government areas.  A total of 682 major fires occurred across the state. Major outbreaks occurred on 27 - 29 September and again on 4 - 7 November. Twenty three houses were destroyed, as well as farm buildings, fences and livestock. Three thousand people were evacuated from their homes. Beerburrum State Forest sustained plantation timber losses of approximately 5000 hectares. Nine volunteer fire fighters were injured, with seven sustaining extensive burns.  The Insurance Council of Australia estimated the 1994 damage at $59.1 million, with the 2011 estimated normalised&nbsp;cost of $215 million.","9/27/1994 0:00","11/07/1994 0:00",-27.08205414,152.9538879,NA,"",3000,0,9,0,59100000,0,0,0,23,0,0,0,0,0,0,0,0,0,0,0,0,0,0,0,0,0,0,0,0,"Queensland",NA,"http://www.emknowledge.gov.au/resource/?id=224",NA,41,23,0
"82",82,82,229,233,"Disaster Event","Earthquake","On 1 March 1954 for 20 to 30 seconds, a 5.5 Richter Scale earthquake caused damage to 3000 buildings including collapsed and cracked walls, smashed windows and collapsed chimneys mainly in the southern suburbs of Adelaide. Some houses were reduced to rubble. The earthquake, which started at approximately 3.45 am, caused some metropolitan areas to lose power for two hours. Several big city buildings were cracked and damaged. It also resulted in three people being seriously injured. At the time, damage from the earthquake was estimated at approximately &pound;3 million.","3/01/1954 0:00","3/01/1954 0:00",-34.97600174,138.6254883,NA,"",0,0,3,0,0,0,0,0,0,3000,0,0,0,0,0,0,0,0,0,0,0,0,0,0,0,0,0,0,0,"South Australia",NA,"http://www.emknowledge.gov.au/resource/?id=233",NA,0,3000,0
"83",83,83,231,235,"Disaster Event","Bushfire","The fire known as Black Sunday occurred on 2 January 1955. The Mount Lofty Ranges east of Adelaide was devastated by fires. Adelaide reached a maximum temperature of 43 &deg;C at 1.00 pm. Wind gusts of 100 km per hour were recorded with higher velocities in the hills. The fire was particularly intense near Upper Sturt where the railway station and several houses were destroyed as well as Crafers, Aldgate, Loftia Park resort; and Marble Hill where the governors' summer residence was burnt down. Two firefighters were killed and 40,000 ha burnt out. The damage bill was estimated at &pound;4 million.","1/02/1955 0:00","1/02/1955 0:00",-35.00764465,138.7087402,NA,"",0,0,0,2,0,0,0,0,0,0,0,0,0,0,0,0,0,0,0,0,0,0,0,0,0,0,0,0,0,"South Australia",NA,"http://www.emknowledge.gov.au/resource/?id=235",NA,0,0,0
"84",84,84,233,237,"Disaster Event","Cyclone/Tornado","Cyclone Bobby travelled south along the west coast of Australia and passed near Onslow. It caused considerable damage to homes and buildings bringing heavy rains which flooded roads, damaged bridges, and caused damage to crops. The mining industry was severely affected.  The cyclone moved slowly and erratically along the Pilbara coast crossing just to the east of Onslow. The highest recorded wind gust was 183 km per hour at Onslow. A gust of 166 km per hour was recorded on Varanus Island off the Western Australian coast. Very heavy rainfall accompanied Bobby, with more than 400 mm of rain falling in the Onslow area.  Very minor property damage was reported from the Karratha area. Approximately 20 houses at Onslow sustained superficial roofing damage. Pastoral stations along the track between Onslow and Gascoyne Junction reported property damage.  Seven lives were lost when two fishing trawlers sunk off the coast from Onslow, and a motorist&nbsp;drowned while attempting to cross a flooded creek at Canarvon.  The Insurance Council of Australia estimated the 1995 damage at $11 million, with the 2012 estimated normalised cost of $48 million.","2/24/1995 0:00","2/27/1995 0:00",-21.63766289,115.1149368,NA,"",0,0,0,8,1.1e+07,0,0,20,0,0,0,0,0,0,0,0,0,0,0,0,0,0,0,0,0,0,0,0,0,"Western Australia",NA,"http://www.emknowledge.gov.au/resource/?id=237",NA,3,20,0
"85",85,85,235,239,"Disaster Event","Bushfire","From 16 September to the end of December 1918, fire spread throughout an area near Charleville, Blackall, Barcaldine, Hughenden and Longreach. Five lives were lost near Saltern Creek.","9/16/1918 0:00","12/30/1918 0:00",-23.44151306,144.2484283,NA,"",0,0,0,5,0,0,0,0,0,0,0,0,0,0,0,0,0,0,0,0,0,0,0,0,0,0,0,0,0,"Queensland",NA,"http://www.emknowledge.gov.au/resource/?id=239",NA,105,0,0
"86",86,86,241,245,"Disaster Event","Bushfire","From 24 December 2001, more than 100 fires burned through parts of New South Wales and the Australian Capital Territory. The first fires to break out were in the Cessnock, Blue Mountains, Hawkesbury and Penrith areas. The fires lasted for approximately 23 days and required over 20,000 regular and volunteer firefighters as well as 85 aircraft. The worst fires were in the Huskisson / Sussex Inlet area near Jervis Bay in the Illawarra and the Deua National Park west of Moruya.  The weather across all affected areas during this time included temperatures of up to 45&ordm; C, winds in excess of 90 km per hour, relative humidity as low as 6 per cent and Fire Danger Ratings of up to 100.  Twenty-six bushfire emergency declarations were made, incorporating the 48 local government areas of Blue Mountains / Lithgow / Rylstone, Cessnock / Wyong, Hawkesbury, Kempsey, Mudgee, Oberon / Mulwarree, Richmond Valley / Maclean, Shoalhaven / Tallaganda, Gosford, Penrith / Fairfield / Blacktown / Liverpool, Singleton / Muswellbrook, Sutherland, Wollondilly / Campbelltown / Wingecarribee, Wollongong / Kiama / Shellharbour, Baulkham Hills / Hornsby / Ku-ring-gai / Ryde / Lane Cove, Grafton / Pristine Waters / Maclean / Copmanhurst, Eurobodalla, Warringah / Pittwater, Narrabri, Kempsey, Cabonne, Coffs Harbour, Richmond Valley, Greater Taree, Kempsey and Walcha.  The fires burnt approximately 753,314 hectares, destroyed 109 houses and damaged a further 40. They also destroyed 433 outbuildings, 222 vehicles, and 7043 stock and 33 commercial and industrial buildings. Vast stretches of forests were destroyed, including more than 60 per cent of the Royal National Park, and more than 510 hectares of pine plantation valued at several million dollars in the Australian Capital Territory. The smoke and smog from the fire caused the Environmental Protection Authority to record the worst ever air pollution in Sydney on 28 December.  Although major fire activity ended on 7 January, operations continued until 11 January. More than 11,000 people were evacuated from their homes, but there were no deaths or major injuries.  An estimated 20,000 properties were saved and the cost of operations was estimated at $106 million.  The Insurance Council of Australia estimated the 2001 damage at $69 million, with the 2011 estimated normalised cost of $131 million.","12/24/2001 0:00","1/11/2002 0:00",-35.05125809,150.6684265,NA,"",11000,0,0,0,6.9e+07,0,0,40,109,0,443,0,0,0,0,0,0,0,0,222,0,0,0,0,0,0,0,7043,0,"New South Wales;Australian Capital Territory",NA,"http://www.emknowledge.gov.au/resource/?id=245",NA,18,592,222
"87",87,87,243,247,"Disaster Event","Earthquake","On 6 August 1994, an earthquake measuring 5.4 on the Richter scale affected the Hunter region of New South Wales. Homes, hotels and other buildings suffered serious damage. There were also infrastructure, commercial and industrial losses.  The Insurance Council of Australia estimated the 1994 damage at $37.2 million, with the 2011 estimated normalised cost of $115 million.","8/06/1994 0:00","8/06/1994 0:00",-32.78034592,151.3469696,NA,"",0,0,0,0,37200000,0,0,0,0,0,0,0,0,0,0,0,0,0,0,0,0,0,0,0,0,0,0,0,0,"New South Wales",NA,"http://www.emknowledge.gov.au/resource/?id=247",NA,0,0,0
"88",88,88,244,248,"Disaster Event","Storm/Flood","On the 8 November 1984, thunderstorms caused extremely heavy rain over a sizeable area near the centre of Sydney. Observatory Hill recorded 196 mm in three hours. Due to large expanses of urban areas being paved, much of the rainfall became flood run-off, causing damage to homes along the Harbour. Vehicles were swept off roads or buried in mud.  Thousands of homes were flooded, and hundreds of people evacuated.  The Insurance Council of Australia estimated the 1984 damage at $80 million, with the 2011 estimated normalised cost of $578 million.","11/08/1984 0:00","11/08/1984 0:00",-33.85963821,151.2046814,NA,"",0,0,0,0,8e+07,0,0,0,0,0,0,0,0,0,0,0,0,0,0,0,0,0,0,0,0,0,0,0,0,"New South Wales",NA,"http://www.emknowledge.gov.au/resource/?id=248",NA,0,0,0
"89",89,89,245,249,"Disaster Event","Drought/Heatwave","On 19 and 23 September 1998, the central and southern wheatbelt of Western Australia experienced severe frosts, the worst in history. These events were extremely damaging as the mild winter accelerated the crop development so that crops were very susceptible to frost damage. The crop damage totalled approximately $98 million.","9/19/1998 0:00","9/23/1998 0:00",-31.47698784,118.2832718,NA,"",0,0,0,0,0,0,0,0,0,0,0,0,0,0,0,0,0,0,0,0,0,0,0,0,0,0,0,0,0,"Western Australia",NA,"http://www.emknowledge.gov.au/resource/?id=249",NA,4,0,0
"90",90,90,247,251,"Disaster Event","Drought/Heatwave","In the summer of 1911 - 1912 it is estimated that 143 people died as a result of the heatwave.  Mortality during heatwaves can be difficult to measure, as deaths tend to occur from exacerbations of chronic medical conditions as well as direct heat related illness, particularly in the frail and elderly. Excess mortality provides a measure of impact, but does not provide information specifically on underlying cause of death (Victorian Government, January 2009 Heatwave in Victoria: an Assessment of Health Impacts).  It is imperative that heatwaves are included in the disaster information, however, for reasons outlined above accurate statistics as to the actual numbers of deaths and injuries in most instances cannot be provided.","12/01/1911 0:00","2/28/1912 0:00",-27.15840912,132.7209015,NA,"",0,0,0,143,0,0,0,0,0,0,0,0,0,0,0,0,0,0,0,0,0,0,0,0,0,0,0,0,0,"Northern Territory;Queensland;New South Wales;Australian Capital Territory;South Australia;Western Australia;Tasmania;Victoria",NA,"http://www.emknowledge.gov.au/resource/?id=251",NA,89,0,0
"91",91,91,250,254,"Disaster Event","Storm/Flood","On 26 January 1971 widespread flooding occurred in Woden Valley, south-east of Canberra, as a result of a super cell thunderstorm. Rainfall started at approximately 7.30 - 7.50 pm and up to 100 mm was recorded in one hour by private rain gauges in the suburb of Farrer and Torrens.  The rain waters filled the creek that ran beside the Woden Valley freeway, and as debris blocked the valley, the backup of water sent a flash flood onto the freeway. The 200 m wide, 1.5 m deep torrent engulfed more than a dozen cars, and caused the deaths of seven people aged between six and 20. A subsequent Coroner's Report found the deaths to be accidental drowning, and the Department of Interior found that approximately $120,000 of public/government owned property was damaged.  The Bureau of Meteorology estimated the total damage bill at $9 million.","1/26/1971 0:00","1/26/1971 0:00",-35.36168671,149.07164,NA,"",0,0,15,7,0,0,0,0,0,0,0,0,0,0,0,0,0,0,0,0,0,0,0,0,0,0,0,0,0,"Australian Capital Territory",NA,"http://www.emknowledge.gov.au/resource/?id=254",NA,0,0,0
"92",92,92,253,257,"Disaster Event","Cyclone/Tornado","On the 6 March 1956, Cyclone Agnes, the first Australian tropical cyclone tracked on radar, passed over Townsville, Ingham, Cairns, McKay and then into the interior. Many homes sustained roof damage and approximately 20 homes were left uninhabitable. As a result of Cyclone Agnes, four deaths occurred from inland flooding.  The 1956 estimated damage cost was &pound;2.5m in Cairns and an estimated damage cost of &pound;1million in Townsville.","3/06/1956 0:00","3/07/1956 0:00",-19.25200272,146.8206024,NA,"",0,0,0,4,0,0,0,0,20,0,0,0,0,0,0,0,0,0,0,0,0,0,0,0,0,0,0,0,0,"Queensland",NA,"http://www.emknowledge.gov.au/resource/?id=257",NA,1,20,0
"93",93,93,258,262,"Disaster Event","Storm/Flood","On 4 August 1986, torrential rain fell within a 24 hour period with rainfall recorded at 327.6 mm.  The subsequent damage included; 10,000 homes damaged, roads flooded, bus, train and ferry services disrupted resulting in people being stranded in the city, electricity supply problems and property damage.  As the rain eased in Sydney the wind shifted more southerly early on 6 August. This caused the Blue Mountains to experience heavy rains, resulting in the largest floods on record on the Cox and Grose rivers. The rain moved south to the Illawarra and west of Wollongong, adding to the already high Georges River (recorded at 4.5 m); the Hawkesbury River peaked at 12.8 m. This resulted in flooding covering the bridge at Milperra. Six deaths were recorded.  The Insurance Council of Australia estimated the 1986 damage at $35 million, with the 2011 estimated normalised cost of $215 million.","8/04/1986 0:00","8/06/1986 0:00",-34.42443466,150.8930969,NA,"",0,0,0,6,3.5e+07,0,0,10000,0,0,0,0,0,0,0,0,0,0,0,0,0,0,0,0,0,0,0,0,0,"New South Wales",NA,"http://www.emknowledge.gov.au/resource/?id=262",NA,2,10000,0
"94",94,94,261,265,"Disaster Event","Storm/Flood","In December 1991, flood waters damaged homes and businesses in Ballarat due to the largest flood event recorded at the time for the Gnarr Creek system. Investment in storm water management systems occurred after this flood in an attempt to avoid a recurrence.  The Insurance Council of Australia estimated the 1991 damage at $24 million, with the 2011 estimated normalised cost of $90 million.","12/16/1991 0:00","12/18/1991 0:00",-37.56203079,143.8566589,NA,"",0,220,0,0,2.4e+07,0,0,0,0,0,0,0,0,0,0,0,0,0,0,0,0,0,0,0,0,0,0,0,0,"Victoria",NA,"http://www.emknowledge.gov.au/resource/?id=265",NA,2,0,0
